{
  "created_at": "2026-05-07T20:00:00Z",
  "detected_constraints": [
    {
      "source_text": "require manager approval",
      "type": "required_role",
      "value": "manager"
    },
    {
      "source_text": "must be separate",
      "type": "separation_of_duties",
      "value": true
    },
    {
      "operation": "transfer_funds",
      "source_text": "above $1M",
      "type": "approval_threshold",
      "value": 1000000
    }
  ],
  "review_id": "review-finance-001",
  "review_status": "pending",
  "source_document": "finance_governance.txt",
  "warnings": []
}
